{
  "lane_id": "wave-b-wp01-scaffold",
  "disposition_ids": [12],
  "fsm_state": "ready",
  "repo": "KooshaPari/HexaKit",
  "worktree": "HexaKit-wtrees/scaffold-spec",
  "branch": "feat/hexakit-scaffold-init",
  "owns": ["docs/contracts/**", "templates/**"],
  "forbidden_paths": ["crates/**", "Cargo.lock"],
  "harness": "cursor-agent",
  "harness_compat": ["forge", "thegent", "codex-fork"],
  "aadp": {
    "session_id": "20260617-eco-wave-b",
    "context_bundle_version": "1.1",
    "agent_context_bundle_hashes": []
  },
  "verify": [
    "bun run tools/check-ecosystem.ts --map-only",
    "cargo check --workspace"
  ],
  "exit_gate": {
    "pr_merged": true,
    "fsm_state": "done",
    "watcher_pass": true,
    "fr_tags": ["FR-ECO-007"]
  },
  "lane_class": "MUTATE_SCAFFOLD",
  "notes": "Example cursor-agent lane for contract scaffold work (Harness API v0 stub)."
}
