{
  "lane_id": "wave-a-wp03-metron",
  "disposition_ids": [48],
  "fsm_state": "claimed",
  "repo": "KooshaPari/PhenoObservability",
  "worktree": "PhenoObservability-wtrees/wave-a",
  "branch": "feat/obs-metron-relocate",
  "owns": ["Metron/**"],
  "forbidden_paths": [],
  "harness": "forge",
  "harness_compat": ["cursor-agent", "thegent", "codex-fork"],
  "aadp": {
    "session_id": "20260617-eco-wave-a",
    "context_bundle_version": "1.1",
    "agent_context_bundle_hashes": []
  },
  "verify": [
    "cargo test -p metron",
    "cargo test --workspace",
    "bun run tools/check-ecosystem.ts --map-only"
  ],
  "exit_gate": {
    "pr_merged": true,
    "fsm_state": "done",
    "watcher_pass": true,
    "fr_tags": ["FR-ECO-012"]
  },
  "lane_class": "MUTATE_RELOCATE",
  "notes": "Example forge lane for Metron crate relocation (Harness API v0 stub)."
}
